id,severity,status,description,reported_by,created_at,notes
1,high,open,"Run button broken in UI - clicking doesn't start run","bryan",2026-01-24,"Broke after recent changes; reproduce: npm start -> run button unresponsive"
2,high,open,"ShapesPaletteDialog does not work - dialog fails to open or populate","bryan",2026-01-24,"Related to backend integration; dialog empty or errors when fetching shapes"
3,high,fixed,"Registration endpoint returns 404 Not Found","bryan",2026-01-24,"Marked fixed on 2026-01-24 by restarting backend via Docker Desktop"
4,medium,open,"Payment methods are currently not configured","bryan",2026-01-24,"Payment UI/backends not configured; PayPal/Stripe keys or endpoints missing"
5,medium,open,"ADA compliance mode forces GUI repaint when enforcement enabled","bryan",2026-01-24,"Enabling ADA mode causes unnecessary GUI repaints; verify repaint behavior and fix enforcement path"
6,high,open,"Load button does not load any grids","bryan",2026-01-24,"Clicking Load returns no grids; check load handler, localStorage, and /v1/shapes endpoints"
7,medium,open,"Simulation motion is not smooth or fluid","bryan",2026-01-24,"Choppy animation/frame drops; investigate StepScheduler, RAF vs worker stepping, and rendering performance"
8,high,open,"Integration with backend is broken - shapes API failing or unreachable","bryan",2026-01-24,"Frontend can't load shapes from backend; check /v1/shapes endpoint and CORS/mounts"
9,high,open,"Login dialog blocked by grid (z-index)","bryan",2026-01-24,"Login modal is behind the grid canvas; likely CSS z-index stacking context issue preventing login UI interaction"
